{
  "repo": "mcp-tool-shop-org/si-rpg-engine",
  "generated_from": {
    "commit_sha": "06c93679bc1f6b442c727cd4e7729b2f059851d0"
  },
  "generated_at": "2026-10-19T12:37:04.049Z",
  "shared_commit_floor": 3,
  "confidence": "low",
  "rows": [
    {
      "id": "mcp-tool-shop-org/si-rpg-engine|file-moved|frame|packages/frame/types.d.ts",
      "rule": "file-moved",
      "value": 0.55,
      "threshold": 0.5,
      "confidence": "low",
      "state": "open",
      "first_seen": "2026-09-25T08:05:47.341Z",
      "last_seen": "2026-10-19T12:37:04.049Z",
      "boundary": "frame",
      "file": "packages/frame/types.d.ts",
      "partner_boundary": "tick"
    },
    {
      "id": "mcp-tool-shop-org/si-rpg-engine|file-moved|tick|packages/tick/predicates.js",
      "rule": "file-moved",
      "value": 0.5,
      "threshold": 0.5,
      "confidence": "low",
      "state": "open",
      "first_seen": "2026-09-25T10:05:43.628Z",
      "last_seen": "2026-10-19T12:37:04.049Z",
      "boundary": "tick",
      "file": "packages/tick/predicates.js",
      "partner_boundary": "load"
    },
    {
      "id": "mcp-tool-shop-org/si-rpg-engine|file-moved|tick|packages/tick/tick.js",
      "rule": "file-moved",
      "value": 0.55,
      "threshold": 0.5,
      "confidence": "low",
      "state": "open",
      "first_seen": "2026-09-25T08:05:47.341Z",
      "last_seen": "2026-10-19T12:37:04.049Z",
      "boundary": "tick",
      "file": "packages/tick/tick.js",
      "partner_boundary": "frame"
    },
    {
      "id": "mcp-tool-shop-org/si-rpg-engine|leaks|frame",
      "rule": "leaks",
      "value": 0.55,
      "threshold": 0,
      "confidence": "low",
      "state": "open",
      "first_seen": "2026-09-25T08:05:47.341Z",
      "last_seen": "2026-10-19T12:37:04.049Z",
      "boundary": "frame"
    },
    {
      "id": "mcp-tool-shop-org/si-rpg-engine|leaks|tick",
      "rule": "leaks",
      "value": 1.55,
      "threshold": 0.666667,
      "confidence": "low",
      "state": "open",
      "first_seen": "2026-09-25T08:05:47.341Z",
      "last_seen": "2026-10-19T12:37:04.049Z",
      "boundary": "tick"
    },
    {
      "id": "mcp-tool-shop-org/si-rpg-engine|two-may-be-one|frame|tick",
      "rule": "two-may-be-one",
      "value": 0.55,
      "threshold": 0,
      "confidence": "low",
      "state": "open",
      "first_seen": "2026-09-25T08:05:47.341Z",
      "last_seen": "2026-10-19T12:37:04.049Z",
      "boundaries": [
        "frame",
        "tick"
      ]
    }
  ]
}
