{
  "repo": "mcp-tool-shop-org/backprop-trace",
  "generated_from": {
    "commit_sha": "e1d9d4aac6e5962997a175c60b7602cac9984f7a"
  },
  "generated_at": "2026-10-19T12:30:18.326Z",
  "shared_commit_floor": 3,
  "confidence": "low",
  "rows": [
    {
      "id": "mcp-tool-shop-org/backprop-trace|file-moved|scripts|scripts/build-pytorch-helper-fixtures.mjs",
      "rule": "file-moved",
      "value": 1,
      "threshold": 0.5,
      "confidence": "low",
      "state": "open",
      "first_seen": "2026-09-24T02:04:33.553Z",
      "last_seen": "2026-10-19T12:30:18.326Z",
      "boundary": "scripts",
      "file": "scripts/build-pytorch-helper-fixtures.mjs",
      "partner_boundary": "test"
    },
    {
      "id": "mcp-tool-shop-org/backprop-trace|file-moved|test|test/import-pytorch-helper.test.ts",
      "rule": "file-moved",
      "value": 1,
      "threshold": 0.5,
      "confidence": "low",
      "state": "open",
      "first_seen": "2026-09-24T02:04:33.553Z",
      "last_seen": "2026-10-19T12:30:18.326Z",
      "boundary": "test",
      "file": "test/import-pytorch-helper.test.ts",
      "partner_boundary": "scripts"
    },
    {
      "id": "mcp-tool-shop-org/backprop-trace|file-moved|test|test/reconcile.doctrine.test.ts",
      "rule": "file-moved",
      "value": 0.588235,
      "threshold": 0.5,
      "confidence": "low",
      "state": "open",
      "first_seen": "2026-09-24T02:04:33.553Z",
      "last_seen": "2026-10-19T12:30:18.326Z",
      "boundary": "test",
      "file": "test/reconcile.doctrine.test.ts",
      "partner_boundary": "src"
    },
    {
      "id": "mcp-tool-shop-org/backprop-trace|file-moved|test|test/schema-loader.test.ts",
      "rule": "file-moved",
      "value": 0.7,
      "threshold": 0.5,
      "confidence": "low",
      "state": "open",
      "first_seen": "2026-09-24T02:04:33.553Z",
      "last_seen": "2026-10-19T12:30:18.326Z",
      "boundary": "test",
      "file": "test/schema-loader.test.ts",
      "partner_boundary": "src"
    },
    {
      "id": "mcp-tool-shop-org/backprop-trace|leaks|scripts",
      "rule": "leaks",
      "value": 1.666667,
      "threshold": 0.666667,
      "confidence": "low",
      "state": "open",
      "first_seen": "2026-09-24T02:04:33.553Z",
      "last_seen": "2026-10-19T12:30:18.326Z",
      "boundary": "scripts"
    },
    {
      "id": "mcp-tool-shop-org/backprop-trace|leaks|test",
      "rule": "leaks",
      "value": 5.167929,
      "threshold": 0,
      "confidence": "low",
      "state": "open",
      "first_seen": "2026-09-24T02:04:33.553Z",
      "last_seen": "2026-10-19T12:30:18.326Z",
      "boundary": "test"
    },
    {
      "id": "mcp-tool-shop-org/backprop-trace|two-may-be-one|scripts|test",
      "rule": "two-may-be-one",
      "value": 1.666667,
      "threshold": 0,
      "confidence": "low",
      "state": "open",
      "first_seen": "2026-09-24T02:04:33.553Z",
      "last_seen": "2026-10-19T12:30:18.326Z",
      "boundaries": [
        "scripts",
        "test"
      ]
    },
    {
      "id": "mcp-tool-shop-org/backprop-trace|two-may-be-one|src|test",
      "rule": "two-may-be-one",
      "value": 3.501262,
      "threshold": 0,
      "confidence": "low",
      "state": "open",
      "first_seen": "2026-09-24T02:04:33.553Z",
      "last_seen": "2026-10-19T12:30:18.326Z",
      "boundaries": [
        "src",
        "test"
      ]
    }
  ]
}
