{
  "repo": "mcp-tool-shop-org/interlock",
  "generated_from": {
    "commit_sha": "7fbc75bb9a882000bfed9a6db245ea79071b1692"
  },
  "generated_at": "2026-10-19T12:33:06.429Z",
  "shared_commit_floor": 3,
  "confidence": "low",
  "rows": [
    {
      "id": "mcp-tool-shop-org/interlock|file-moved|src|src/interlock/harness/fill.py",
      "rule": "file-moved",
      "value": 0.625,
      "threshold": 0.5,
      "confidence": "low",
      "state": "open",
      "first_seen": "2026-10-19T12:33:06.429Z",
      "last_seen": "2026-10-19T12:33:06.429Z",
      "boundary": "src",
      "file": "src/interlock/harness/fill.py",
      "partner_boundary": "tests"
    },
    {
      "id": "mcp-tool-shop-org/interlock|file-moved|src|src/interlock/harness/runner.py",
      "rule": "file-moved",
      "value": 0.625,
      "threshold": 0.5,
      "confidence": "low",
      "state": "open",
      "first_seen": "2026-10-19T12:33:06.429Z",
      "last_seen": "2026-10-19T12:33:06.429Z",
      "boundary": "src",
      "file": "src/interlock/harness/runner.py",
      "partner_boundary": "tests"
    },
    {
      "id": "mcp-tool-shop-org/interlock|file-moved|tests|tests/test_e5_preflight.py",
      "rule": "file-moved",
      "value": 0.625,
      "threshold": 0.5,
      "confidence": "low",
      "state": "open",
      "first_seen": "2026-10-19T12:33:06.429Z",
      "last_seen": "2026-10-19T12:33:06.429Z",
      "boundary": "tests",
      "file": "tests/test_e5_preflight.py",
      "partner_boundary": "src"
    },
    {
      "id": "mcp-tool-shop-org/interlock|file-moved|tests|tests/test_fill_card_live.py",
      "rule": "file-moved",
      "value": 0.538462,
      "threshold": 0.5,
      "confidence": "low",
      "state": "open",
      "first_seen": "2026-10-19T12:33:06.429Z",
      "last_seen": "2026-10-19T12:33:06.429Z",
      "boundary": "tests",
      "file": "tests/test_fill_card_live.py",
      "partner_boundary": "src"
    },
    {
      "id": "mcp-tool-shop-org/interlock|leaks|src",
      "rule": "leaks",
      "value": 1.788462,
      "threshold": 0.6,
      "confidence": "low",
      "state": "open",
      "first_seen": "2026-10-19T12:33:06.429Z",
      "last_seen": "2026-10-19T12:33:06.429Z",
      "boundary": "src"
    },
    {
      "id": "mcp-tool-shop-org/interlock|leaks|tests",
      "rule": "leaks",
      "value": 1.788462,
      "threshold": 0,
      "confidence": "low",
      "state": "open",
      "first_seen": "2026-10-19T12:33:06.429Z",
      "last_seen": "2026-10-19T12:33:06.429Z",
      "boundary": "tests"
    },
    {
      "id": "mcp-tool-shop-org/interlock|two-may-be-one|src|tests",
      "rule": "two-may-be-one",
      "value": 1.788462,
      "threshold": 0,
      "confidence": "low",
      "state": "open",
      "first_seen": "2026-10-19T12:33:06.429Z",
      "last_seen": "2026-10-19T12:33:06.429Z",
      "boundaries": [
        "src",
        "tests"
      ]
    }
  ]
}
