{
  "repo": "mcp-tool-shop-org/db-cluster",
  "generated_from": {
    "commit_sha": "0ae53ee4dcc9e908b83f0184a8777b3857cb8403"
  },
  "generated_at": "2026-10-19T12:31:40.793Z",
  "shared_commit_floor": 3,
  "confidence": "low",
  "rows": [
    {
      "id": "mcp-tool-shop-org/db-cluster|file-moved|scripts|scripts/completeness-checks.mjs",
      "rule": "file-moved",
      "value": 0.555556,
      "threshold": 0.5,
      "confidence": "low",
      "state": "open",
      "first_seen": "2026-09-24T11:50:33.918Z",
      "last_seen": "2026-10-19T12:31:40.793Z",
      "boundary": "scripts",
      "file": "scripts/completeness-checks.mjs",
      "partner_boundary": "src"
    },
    {
      "id": "mcp-tool-shop-org/db-cluster|leaks|scripts",
      "rule": "leaks",
      "value": 0.555556,
      "threshold": 0,
      "confidence": "low",
      "state": "open",
      "first_seen": "2026-09-24T11:50:33.918Z",
      "last_seen": "2026-10-19T12:31:40.793Z",
      "boundary": "scripts"
    },
    {
      "id": "mcp-tool-shop-org/db-cluster|two-may-be-one|scripts|src",
      "rule": "two-may-be-one",
      "value": 0.555556,
      "threshold": 0,
      "confidence": "low",
      "state": "open",
      "first_seen": "2026-09-24T11:50:33.918Z",
      "last_seen": "2026-10-19T12:31:40.793Z",
      "boundaries": [
        "scripts",
        "src"
      ]
    }
  ]
}
