{
  "repo": "mcp-tool-shop-org/role-set",
  "generated_from": {
    "commit_sha": "8d959193d999756c8d1a98c828927a30959c315c"
  },
  "generated_at": "2026-10-12T14:47:20.275Z",
  "shared_commit_floor": 3,
  "confidence": "low",
  "rows": [
    {
      "id": "mcp-tool-shop-org/role-set|file-moved|src|src/role_set/assemble.py",
      "rule": "file-moved",
      "value": 0.555556,
      "threshold": 0.5,
      "confidence": "low",
      "state": "open",
      "first_seen": "2026-10-12T14:47:20.275Z",
      "last_seen": "2026-10-12T14:47:20.275Z",
      "boundary": "src",
      "file": "src/role_set/assemble.py",
      "partner_boundary": "tests"
    },
    {
      "id": "mcp-tool-shop-org/role-set|file-moved|src|src/role_set/cli.py",
      "rule": "file-moved",
      "value": 0.5,
      "threshold": 0.5,
      "confidence": "low",
      "state": "open",
      "first_seen": "2026-10-12T14:47:20.275Z",
      "last_seen": "2026-10-12T14:47:20.275Z",
      "boundary": "src",
      "file": "src/role_set/cli.py",
      "partner_boundary": "tests"
    },
    {
      "id": "mcp-tool-shop-org/role-set|file-moved|src|src/role_set/gates.py",
      "rule": "file-moved",
      "value": 1,
      "threshold": 0.5,
      "confidence": "low",
      "state": "open",
      "first_seen": "2026-10-12T14:47:20.275Z",
      "last_seen": "2026-10-12T14:47:20.275Z",
      "boundary": "src",
      "file": "src/role_set/gates.py",
      "partner_boundary": "tests"
    },
    {
      "id": "mcp-tool-shop-org/role-set|file-moved|src|src/role_set/puzzle.py",
      "rule": "file-moved",
      "value": 1,
      "threshold": 0.5,
      "confidence": "low",
      "state": "open",
      "first_seen": "2026-10-12T14:47:20.275Z",
      "last_seen": "2026-10-12T14:47:20.275Z",
      "boundary": "src",
      "file": "src/role_set/puzzle.py",
      "partner_boundary": "tests"
    },
    {
      "id": "mcp-tool-shop-org/role-set|file-moved|src|src/role_set/readout.py",
      "rule": "file-moved",
      "value": 0.666667,
      "threshold": 0.5,
      "confidence": "low",
      "state": "open",
      "first_seen": "2026-10-12T14:47:20.275Z",
      "last_seen": "2026-10-12T14:47:20.275Z",
      "boundary": "src",
      "file": "src/role_set/readout.py",
      "partner_boundary": "tests"
    },
    {
      "id": "mcp-tool-shop-org/role-set|file-moved|src|src/role_set/runner.py",
      "rule": "file-moved",
      "value": 0.5625,
      "threshold": 0.5,
      "confidence": "low",
      "state": "open",
      "first_seen": "2026-10-12T14:47:20.275Z",
      "last_seen": "2026-10-12T14:47:20.275Z",
      "boundary": "src",
      "file": "src/role_set/runner.py",
      "partner_boundary": "tests"
    },
    {
      "id": "mcp-tool-shop-org/role-set|file-moved|src|src/role_set/write.py",
      "rule": "file-moved",
      "value": 0.727273,
      "threshold": 0.5,
      "confidence": "low",
      "state": "open",
      "first_seen": "2026-10-12T14:47:20.275Z",
      "last_seen": "2026-10-12T14:47:20.275Z",
      "boundary": "src",
      "file": "src/role_set/write.py",
      "partner_boundary": "tests"
    },
    {
      "id": "mcp-tool-shop-org/role-set|file-moved|tests|tests/test_assemble.py",
      "rule": "file-moved",
      "value": 0.555556,
      "threshold": 0.5,
      "confidence": "low",
      "state": "open",
      "first_seen": "2026-10-12T14:47:20.275Z",
      "last_seen": "2026-10-12T14:47:20.275Z",
      "boundary": "tests",
      "file": "tests/test_assemble.py",
      "partner_boundary": "src"
    },
    {
      "id": "mcp-tool-shop-org/role-set|file-moved|tests|tests/test_cli.py",
      "rule": "file-moved",
      "value": 0.5,
      "threshold": 0.5,
      "confidence": "low",
      "state": "open",
      "first_seen": "2026-10-12T14:47:20.275Z",
      "last_seen": "2026-10-12T14:47:20.275Z",
      "boundary": "tests",
      "file": "tests/test_cli.py",
      "partner_boundary": "src"
    },
    {
      "id": "mcp-tool-shop-org/role-set|file-moved|tests|tests/test_gates.py",
      "rule": "file-moved",
      "value": 1,
      "threshold": 0.5,
      "confidence": "low",
      "state": "open",
      "first_seen": "2026-10-12T14:47:20.275Z",
      "last_seen": "2026-10-12T14:47:20.275Z",
      "boundary": "tests",
      "file": "tests/test_gates.py",
      "partner_boundary": "src"
    },
    {
      "id": "mcp-tool-shop-org/role-set|file-moved|tests|tests/test_paid_run_data.py",
      "rule": "file-moved",
      "value": 0.666667,
      "threshold": 0.5,
      "confidence": "low",
      "state": "open",
      "first_seen": "2026-10-12T14:47:20.275Z",
      "last_seen": "2026-10-12T14:47:20.275Z",
      "boundary": "tests",
      "file": "tests/test_paid_run_data.py",
      "partner_boundary": "src"
    },
    {
      "id": "mcp-tool-shop-org/role-set|file-moved|tests|tests/test_puzzle.py",
      "rule": "file-moved",
      "value": 1,
      "threshold": 0.5,
      "confidence": "low",
      "state": "open",
      "first_seen": "2026-10-12T14:47:20.275Z",
      "last_seen": "2026-10-12T14:47:20.275Z",
      "boundary": "tests",
      "file": "tests/test_puzzle.py",
      "partner_boundary": "src"
    },
    {
      "id": "mcp-tool-shop-org/role-set|file-moved|tests|tests/test_runner.py",
      "rule": "file-moved",
      "value": 0.5625,
      "threshold": 0.5,
      "confidence": "low",
      "state": "open",
      "first_seen": "2026-10-12T14:47:20.275Z",
      "last_seen": "2026-10-12T14:47:20.275Z",
      "boundary": "tests",
      "file": "tests/test_runner.py",
      "partner_boundary": "src"
    },
    {
      "id": "mcp-tool-shop-org/role-set|file-moved|tests|tests/test_write.py",
      "rule": "file-moved",
      "value": 0.727273,
      "threshold": 0.5,
      "confidence": "low",
      "state": "open",
      "first_seen": "2026-10-12T14:47:20.275Z",
      "last_seen": "2026-10-12T14:47:20.275Z",
      "boundary": "tests",
      "file": "tests/test_write.py",
      "partner_boundary": "src"
    },
    {
      "id": "mcp-tool-shop-org/role-set|leaks|src",
      "rule": "leaks",
      "value": 5.011996,
      "threshold": 1.053222,
      "confidence": "low",
      "state": "open",
      "first_seen": "2026-10-12T14:47:20.275Z",
      "last_seen": "2026-10-12T14:47:20.275Z",
      "boundary": "src"
    },
    {
      "id": "mcp-tool-shop-org/role-set|leaks|tests",
      "rule": "leaks",
      "value": 5.011996,
      "threshold": 0,
      "confidence": "low",
      "state": "open",
      "first_seen": "2026-10-12T14:47:20.275Z",
      "last_seen": "2026-10-12T14:47:20.275Z",
      "boundary": "tests"
    },
    {
      "id": "mcp-tool-shop-org/role-set|two-may-be-one|src|tests",
      "rule": "two-may-be-one",
      "value": 5.011996,
      "threshold": 0,
      "confidence": "low",
      "state": "open",
      "first_seen": "2026-10-12T14:47:20.275Z",
      "last_seen": "2026-10-12T14:47:20.275Z",
      "boundaries": [
        "src",
        "tests"
      ]
    }
  ]
}
