{
  "repo": "mcp-tool-shop-org/aspire-si",
  "generated_from": {
    "commit_sha": "4b755dfd8901bea879cd02b32a4a7f0a1189dd9c"
  },
  "generated_at": "2026-10-26T12:27:37.178Z",
  "shared_commit_floor": 3,
  "confidence": "low",
  "rows": [
    {
      "id": "mcp-tool-shop-org/aspire-si|file-moved|tests|tests/test_critic_heads.py",
      "rule": "file-moved",
      "value": 0.5,
      "threshold": 0.5,
      "confidence": "low",
      "state": "open",
      "first_seen": "2026-10-12T14:44:49.639Z",
      "last_seen": "2026-10-26T12:27:37.178Z",
      "boundary": "tests",
      "file": "tests/test_critic_heads.py",
      "partner_boundary": "examples"
    },
    {
      "id": "mcp-tool-shop-org/aspire-si|leaks|tests",
      "rule": "leaks",
      "value": 0.5,
      "threshold": 0,
      "confidence": "low",
      "state": "open",
      "first_seen": "2026-10-12T14:44:49.639Z",
      "last_seen": "2026-10-26T12:27:37.178Z",
      "boundary": "tests"
    },
    {
      "id": "mcp-tool-shop-org/aspire-si|two-may-be-one|examples|tests",
      "rule": "two-may-be-one",
      "value": 0.5,
      "threshold": 0,
      "confidence": "low",
      "state": "open",
      "first_seen": "2026-10-12T14:44:49.639Z",
      "last_seen": "2026-10-26T12:27:37.178Z",
      "boundaries": [
        "examples",
        "tests"
      ]
    }
  ]
}
