{
  "repo": "mcp-tool-shop-org/portlight-bounty",
  "generated_from": {
    "commit_sha": "baff06459cf143d60f138c98c04204c31cf8b662"
  },
  "generated_at": "2026-10-12T14:46:43.978Z",
  "shared_commit_floor": 3,
  "confidence": "low",
  "rows": [
    {
      "id": "mcp-tool-shop-org/portlight-bounty|file-moved|portlight-chart|crates/portlight-chart/src/landing.rs",
      "rule": "file-moved",
      "value": 0.5,
      "threshold": 0.5,
      "confidence": "low",
      "state": "open",
      "first_seen": "2026-10-12T14:46:43.978Z",
      "last_seen": "2026-10-12T14:46:43.978Z",
      "boundary": "portlight-chart",
      "file": "crates/portlight-chart/src/landing.rs",
      "partner_boundary": "tools"
    },
    {
      "id": "mcp-tool-shop-org/portlight-bounty|file-moved|portlight-sim|crates/portlight-sim/src/script.rs",
      "rule": "file-moved",
      "value": 0.777778,
      "threshold": 0.5,
      "confidence": "low",
      "state": "open",
      "first_seen": "2026-10-12T14:46:43.978Z",
      "last_seen": "2026-10-12T14:46:43.978Z",
      "boundary": "portlight-sim",
      "file": "crates/portlight-sim/src/script.rs",
      "partner_boundary": "tools"
    },
    {
      "id": "mcp-tool-shop-org/portlight-bounty|file-moved|portlight-sim|crates/portlight-sim/src/session.rs",
      "rule": "file-moved",
      "value": 0.692308,
      "threshold": 0.5,
      "confidence": "low",
      "state": "open",
      "first_seen": "2026-10-12T14:46:43.978Z",
      "last_seen": "2026-10-12T14:46:43.978Z",
      "boundary": "portlight-sim",
      "file": "crates/portlight-sim/src/session.rs",
      "partner_boundary": "tools"
    },
    {
      "id": "mcp-tool-shop-org/portlight-bounty|file-moved|tools|tools/build_manifest_pb002.py",
      "rule": "file-moved",
      "value": 0.5,
      "threshold": 0.5,
      "confidence": "low",
      "state": "open",
      "first_seen": "2026-10-12T14:46:43.978Z",
      "last_seen": "2026-10-12T14:46:43.978Z",
      "boundary": "tools",
      "file": "tools/build_manifest_pb002.py",
      "partner_boundary": "portlight-chart"
    },
    {
      "id": "mcp-tool-shop-org/portlight-bounty|file-moved|tools|tools/parity/oracle.py",
      "rule": "file-moved",
      "value": 0.777778,
      "threshold": 0.5,
      "confidence": "low",
      "state": "open",
      "first_seen": "2026-10-12T14:46:43.978Z",
      "last_seen": "2026-10-12T14:46:43.978Z",
      "boundary": "tools",
      "file": "tools/parity/oracle.py",
      "partner_boundary": "portlight-sim"
    },
    {
      "id": "mcp-tool-shop-org/portlight-bounty|leaks|tools",
      "rule": "leaks",
      "value": 4.181198,
      "threshold": 0,
      "confidence": "low",
      "state": "open",
      "first_seen": "2026-10-12T14:46:43.978Z",
      "last_seen": "2026-10-12T14:46:43.978Z",
      "boundary": "tools"
    },
    {
      "id": "mcp-tool-shop-org/portlight-bounty|two-may-be-one|portlight-chart|tools",
      "rule": "two-may-be-one",
      "value": 0.5,
      "threshold": 0,
      "confidence": "low",
      "state": "open",
      "first_seen": "2026-10-12T14:46:43.978Z",
      "last_seen": "2026-10-12T14:46:43.978Z",
      "boundaries": [
        "portlight-chart",
        "tools"
      ]
    },
    {
      "id": "mcp-tool-shop-org/portlight-bounty|two-may-be-one|portlight-sim|tools",
      "rule": "two-may-be-one",
      "value": 3.681198,
      "threshold": 0,
      "confidence": "low",
      "state": "open",
      "first_seen": "2026-10-12T14:46:43.978Z",
      "last_seen": "2026-10-12T14:46:43.978Z",
      "boundaries": [
        "portlight-sim",
        "tools"
      ]
    }
  ]
}
