{
  "repo": "mcp-tool-shop-org/ollama-intern-mcp",
  "generated_from": {
    "commit_sha": "769b4a6fb8e1696d00149f17a190cffc9836a7d7"
  },
  "generated_at": "2026-10-19T12:34:31.465Z",
  "shared_commit_floor": 3,
  "confidence": "low",
  "rows": [
    {
      "id": "mcp-tool-shop-org/ollama-intern-mcp|file-moved|src|src/tools/batchProofCheck.ts",
      "rule": "file-moved",
      "value": 0.555556,
      "threshold": 0.5,
      "confidence": "low",
      "state": "open",
      "first_seen": "2026-09-24T02:34:49.531Z",
      "last_seen": "2026-10-19T12:34:31.465Z",
      "boundary": "src",
      "file": "src/tools/batchProofCheck.ts",
      "partner_boundary": "tests"
    },
    {
      "id": "mcp-tool-shop-org/ollama-intern-mcp|file-moved|src|src/tools/classify.ts",
      "rule": "file-moved",
      "value": 0.714286,
      "threshold": 0.5,
      "confidence": "low",
      "state": "open",
      "first_seen": "2026-09-24T02:34:49.531Z",
      "last_seen": "2026-10-19T12:34:31.465Z",
      "boundary": "src",
      "file": "src/tools/classify.ts",
      "partner_boundary": "tests"
    },
    {
      "id": "mcp-tool-shop-org/ollama-intern-mcp|file-moved|tests|tests/tools/batchProofCheck.test.ts",
      "rule": "file-moved",
      "value": 0.555556,
      "threshold": 0.5,
      "confidence": "low",
      "state": "open",
      "first_seen": "2026-09-24T02:34:49.531Z",
      "last_seen": "2026-10-19T12:34:31.465Z",
      "boundary": "tests",
      "file": "tests/tools/batchProofCheck.test.ts",
      "partner_boundary": "src"
    },
    {
      "id": "mcp-tool-shop-org/ollama-intern-mcp|file-moved|tests|tests/tools/classify.test.ts",
      "rule": "file-moved",
      "value": 0.714286,
      "threshold": 0.5,
      "confidence": "low",
      "state": "open",
      "first_seen": "2026-09-24T02:34:49.531Z",
      "last_seen": "2026-10-19T12:34:31.465Z",
      "boundary": "tests",
      "file": "tests/tools/classify.test.ts",
      "partner_boundary": "src"
    },
    {
      "id": "mcp-tool-shop-org/ollama-intern-mcp|leaks|tests",
      "rule": "leaks",
      "value": 1.269842,
      "threshold": 0,
      "confidence": "low",
      "state": "open",
      "first_seen": "2026-09-24T02:34:49.531Z",
      "last_seen": "2026-10-19T12:34:31.465Z",
      "boundary": "tests"
    },
    {
      "id": "mcp-tool-shop-org/ollama-intern-mcp|two-may-be-one|src|tests",
      "rule": "two-may-be-one",
      "value": 1.269842,
      "threshold": 0,
      "confidence": "low",
      "state": "open",
      "first_seen": "2026-09-24T02:34:49.531Z",
      "last_seen": "2026-10-19T12:34:31.465Z",
      "boundaries": [
        "src",
        "tests"
      ]
    }
  ]
}
